id,kural_tamil,kural_english,meaning_tamil,meaning_english,audio_tamil_url,audio_english_url,youtube_tamil_url,youtube_english_url
1,அகர முதல எழுத்தெல்லாம் ஆதி\nபகவன் முதற்றே உலகு,அகர முதல எழுத்தெல்லாம் ஆதி\nபகவன் முதற்றே உலகு,"அகரம் எழுத்துக்களுக்கு முதன்மை; ஆதிபகவன், உலகில் வாழும் உயிர்களுக்கு முதன்மை.","A, as its first of letters, every speech maintains; The ""Primal Deity"" is first through all the world's domains",https://github.com/Thirukuraliq/LearnKural/blob/ce9541a2857bba6f8b365eca01c5146476b25e96/kural1.mp3,https://github.com/Thirukuraliq/LearnKural/blob/ce9541a2857bba6f8b365eca01c5146476b25e96/kural1.mp3,https://youtu.be/BbP1L0LKr_o,https://youtu.be/qqQ35bQLvkI
2,கற்றதனால் ஆய பயனென்கொல் வாலறிவன்\nநற்றாள் தொழாஅ ரெனின்,கற்றதனால் ஆய பயனென்கொல் வாலறிவன்\nநற்றாள் தொழாஅ ரெனின்,தன்னைவிட அறிவில் மூத்த பெருந்தகையாளரின் முன்னே வணங்கி நிற்கும் பண்பு இல்லாவிடில் என்னதான் ஒருவர் கற்றிருந்தாலும் அதனால்என்ன பயன்? ஒன்றுமில்லை,"No matter how much education a person has, if he does not show respect to the noble and virtuous (those who uphold righteousness and good character), then what is the use of his learning?",https://github.com/Thirukuraliq/LearnKural/blob/299af2d7ef3e71b95551c411c954f44a65550fcf/kural2.mp3,https://github.com/Thirukuraliq/LearnKural/blob/299af2d7ef3e71b95551c411c954f44a65550fcf/kural2.mp3,https://youtu.be/xt9Kq0mcC-E,https://youtu.be/r8j6YSK3byM
3,மலர்மிசை ஏகினான் மாணடி சேர்ந்தார்\nநிலமிசை நீடுவாழ் வார்,மலர்மிசை ஏகினான் மாணடி சேர்ந்தார்\nநிலமிசை நீடுவாழ் வார்,"ஒருவர் உயர்ந்த நற்பண்புகளைக் கொண்ட கடவுளின் அடியை அடைந்தால் (அதாவது தர்மத்தின் பாதையில் நடக்கத் தெரிந்தால்), அவருடைய வாழ்வு நிலையாகும், நீடித்தும் சிறப்பாகவும் இருக்கும். இது அறத்தின் முக்கியத்துவத்தை வலியுறுத்தும் குறள்களில் ஒன்று.","If a person reaches the feet of the divine—meaning, if they learn to walk the path of righteousness and virtue—their life will become stable, long-lasting, and meaningful. This is one of the Kurals that emphasizes the importance of living a virtuous life.",https://github.com/Thirukuraliq/LearnKural/blob/55007a8ea61918707b1120db9b21eab196699a7b/kural3.mp3,https://github.com/Thirukuraliq/LearnKural/blob/55007a8ea61918707b1120db9b21eab196699a7b/kural3.mp3,https://youtu.be/cV2eKkyJ6lo,https://youtu.be/e3Cbcd2m8uY
4,வேண்டுதல் வேண்டாமை இலான்அடி சேர்ந்தார்க்கு\nயாண்டும் இடும்பை இல,வேண்டுதல் வேண்டாமை இலான்அடி சேர்ந்தார்க்கு\nயாண்டும் இடும்பை இல,விருப்பும் வெறுப்பும் இல்லாத கடவுளின் அடிகளைச் சேர்ந்தவர்களுக்கு எக்காலத்திலும் துன்பம் இல்லை.,"To those who have reached the feet of Him who is void of desire or aversion, evil shall never come.",https://github.com/Thirukuraliq/LearnKural/blob/cde404f40763c99ac5c778797302bb798553d575/kural4.mp3,https://github.com/Thirukuraliq/LearnKural/blob/cde404f40763c99ac5c778797302bb798553d575/kural4.mp3,https://youtu.be/n0H7t31xMrs,https://youtu.be/R-SmcEh8f7U
5,இருள்சேர் இருவினையும் சேரா இறைவன்\nபொருள்சேர் புகழ்தல் புரிந்தார் மாட்டு,இருள்சேர் இருவினையும் சேரா இறைவன்\nபொருள்சேர் புகழ்தல் புரிந்தார் மாட்டு,கடவுளின் உண்மைப் புகழ்களை விரும்பிப் போற்றுபவரிடம் அறியாமையால் வரும் இருவகை வினைகளும் சேர்வதில்லை.,The two-fold deeds that spring from darkness shall not adhere to those who delight in praising the true glory of God.,https://github.com/Thirukuraliq/LearnKural/blob/cde404f40763c99ac5c778797302bb798553d575/kural5.mp3,https://github.com/Thirukuraliq/LearnKural/blob/cde404f40763c99ac5c778797302bb798553d575/kural5.mp3,https://youtu.be/Oy8_uyW-i-I,https://youtu.be/olIoA8r1emc
6,பொறிவாயில் ஐந்தவித்தான் பொய்தீர் ஒழுக்க\nநெறிநின்றார் நீடுவாழ் வார்,பொறிவாயில் ஐந்தவித்தான் பொய்தீர் ஒழுக்க\nநெறிநின்றார் நீடுவாழ் வார்,ஐம்புல ஆசைகளை ஒழித்தவனின் பொய்யற்ற ஒழுக்க வழியில் நின்றவர் நிலையான வாழ்வைப் பெறுவர்.,They shall live long who abide in the faultless way of Him who has subdued the five senses.,https://github.com/Thirukuraliq/LearnKural/blob/38144f1e8355c39764a65532c1fb3222eed8a264/kural6.mp3,https://github.com/Thirukuraliq/LearnKural/blob/38144f1e8355c39764a65532c1fb3222eed8a264/kural6.mp3,https://youtu.be/gdDhto4ECYc,https://youtu.be/27phwklX7bs
7,தனக்குவமை இல்லாதான் தாள்சேர்ந்தார்க் கல்லால்\nமனக்கவலை மாற்றல் அரிது,தனக்குவமை இல்லாதான் தாள்சேர்ந்தார்க் கல்லால்\nமனக்கவலை மாற்றல் அரிது,"தனக்கு இணையில்லாதவனின் அடிகளைச் சேர்ந்தவர்க்கல்லாமல், மற்றவர்களுக்கு மனக்கவலையை நீக்குதல் அரிது.","Anxiety of mind cannot be removed, except from those who are united to the feet of Him to whom there is no likeness.",https://github.com/Thirukuraliq/LearnKural/blob/586ba0d8b7079de14c40629a9adc3b7fca36ea30/kural7.mp3,https://github.com/Thirukuraliq/LearnKural/blob/586ba0d8b7079de14c40629a9adc3b7fca36ea30/kural7.mp3,https://youtu.be/VniUCLdD2Es,https://youtu.be/C8-5U9NEEG8
8,அறவாழி அந்தணன் தாள்சேர்ந்தார்க் கல்லால்\nபிறவாழி நீந்தல் அரிது,அறவாழி அந்தணன் தாள்சேர்ந்தார்க் கல்லால்\nபிறவாழி நீந்தல் அரிது,"அறக்கடலாகிய அந்தணனின் அடிகளைச் சேர்ந்தவர்க்கல்லாமல், மற்றவர்களுக்குப் பிறவியாகிய கடலை நீந்திக் கடப்பது அரிது.","It is impossible to swim the sea of births, except by those who are united to the feet of the gracious Being who is a sea of virtue.",https://github.com/Thirukuraliq/LearnKural/blob/586ba0d8b7079de14c40629a9adc3b7fca36ea30/kural8.mp3,https://github.com/Thirukuraliq/LearnKural/blob/586ba0d8b7079de14c40629a9adc3b7fca36ea30/kural8.mp3,https://youtu.be/Afg8Cg3TP5M,https://youtu.be/BhjaLtVKTm4
9,கோளில் பொறியின் குணமிலவே எண்குணத்தான்\nதாளை வணங்காத் தலை,கோளில் பொறியின் குணமிலவே எண்குணத்தான்\nதாளை வணங்காத் தலை,"எட்டு குணங்களை உடையவனின் அடிகளை வணங்காத தலை, பயனற்ற புலன்களைப் போல எந்த நற்குணமும் இல்லாதது.","The head that bows not before the feet of Him who is possessed of eight attributes, is like a sense without the power of perception.",https://github.com/Thirukuraliq/LearnKural/blob/31ded053bc5b0924ba3e8efcfa2f0c43f1cdabfa/kural9.mp3,https://github.com/Thirukuraliq/LearnKural/blob/31ded053bc5b0924ba3e8efcfa2f0c43f1cdabfa/kural9.mp3,https://youtu.be/WVdBmzu0L4o,https://youtu.be/batcvJpX4no
10,பிறவிப் பெருங்கடல் நீந்துவர் நீந்தார்\nஇறைவன் அடிசேரா தார்,பிறவிப் பெருங்கடல் நீந்துவர் நீந்தார்\nஇறைவன் அடிசேரா தார்,இறைவனின் அடிகளைச் சேர்ந்தவர் பிறவியாகிய பெரிய கடலை நீந்திக் கடப்பர்; சேராதவர் நீந்த மாட்டார்.,They alone can cross the great sea of births who are united to the feet of God; none else can do so.,https://github.com/Thirukuraliq/LearnKural/blob/31ded053bc5b0924ba3e8efcfa2f0c43f1cdabfa/kural10.mp3,https://github.com/Thirukuraliq/LearnKural/blob/31ded053bc5b0924ba3e8efcfa2f0c43f1cdabfa/kural10.mp3,https://youtu.be/KsGOgAfmgrQ,https://youtu.be/Um8aPcta6b8
11,வான்நின்று உலகம் வழங்கி வருதலால்\nதான்அமிழ்தம் என்றுணரற் பாற்று,வான்நின்று உலகம் வழங்கி வருதலால்\nதான்அமிழ்தம் என்றுணரற் பாற்று,"மழை பெய்ய உலகம் வாழ்ந்து வருவதால், மழையானது உலகத்து வாழும் உயிர்களுக்கு அமிழ்தம் என்று உணரத்தக்கதாகும்",Rain is deemed a nectar of life as its unfailing fall sustains the world,,,,
12,துப்பார்க்குத் துப்பாய துப்பாக்கித் துப்பார்க்குத்\nதுப்பாய தூஉம் மழை,துப்பார்க்குத் துப்பாய துப்பாக்கித் துப்பார்க்குத்\nதுப்பாய தூஉம் மழை,"யாருக்கு உணவுப் பொருள்களை விளைவித்துத்தர மழை பயன்படுகிறதோ, அவர்களுக்கே அந்த மழை அவர்கள் அருந்தும் உணவாகவும் ஆகி அரிய தியாகத்தைச் செய்கிறது",Rain is not only a consumable for the consumer But also begets other consumables,,,,
13,விண்இன்று பொய்ப்பின் விரிநீர் வியனுலகத்து\nஉள்நின்று உடற்றும் பசி,விண்இன்று பொய்ப்பின் விரிநீர் வியனுலகத்து\nஉள்நின்று உடற்றும் பசி,"கடல்நீர் சூழ்ந்த உலகமாயினும், மழைநீர் பொய்த்துவிட்டால் பசியின் கொடுமை வாட்டி வதைக்கும்","This vast world, with expanse of seas, will still suffer with famine if clouds deceive rain",,,,
14,ஏரின் உழாஅர் உழவர் புயல்என்னும்\nவாரி வளங்குன்றிக் கால்,ஏரின் உழாஅர் உழவர் புயல்என்னும்\nவாரி வளங்குன்றிக் கால்,"மழை என்னும் வருவாய் வளம் குன்றிவிட்டால், உழவுத் தொழில் குன்றிவிடும்","If that bounty called rain decrease, ploughing by ploughmen would also cease",,,,
15,கெடுப்பதூஉம் கெட்டார்க்குச் சார்வாய்மற் றாங்கே\nஎடுப்பதூஉம் எல்லாம் மழை,கெடுப்பதூஉம் கெட்டார்க்குச் சார்வாய்மற் றாங்கே\nஎடுப்பதூஉம் எல்லாம் மழை,பெய்யாமல் வாழ்வைக் கெடுக்க வல்லதும் மழை; மழையில்லாமல் வளம் கெட்டு நொந்தவர்க்கும் துணையாய் அவ்வாறே காக்க வல்லதும் மழையாகும்,Rain holds the power of ruin.Rain also lifts up those it has ruined,,,,
16,விசும்பின் துளிவீழின் அல்லால்மற் றாங்கே\nபசும்புல் தலைகாண்பு அரிது,விசும்பின் துளிவீழின் அல்லால்மற் றாங்கே\nபசும்புல் தலைகாண்பு அரிது,விண்ணிலிருந்து மழைத்துளி விழுந்தாலன்றி மண்ணில் பசும்புல் தலை காண்பது அரிதான ஒன்றாகும்,"If clouds stop dropping raindrops, even blades of grass will stop rising",,,,
17,நெடுங்கடலும் தன்நீர்மை குன்றும் தடிந்தெழிலி\nதான்நல்கா தாகி விடின்,நெடுங்கடலும் தன்நீர்மை குன்றும் தடிந்தெழிலி\nதான்நல்கா தாகி விடின்,ஆவியான கடல்நீர் மேகமாகி அந்தக் கடலில் மழையாகப் பெய்தால்தான் கடல்கூட வற்றாமல் இருக்கும். மனித சமுதாயத்திலிருந்து புகழுடன் உயர்ந்தவர்களும் அந்தச் சமுதாயத்திற்கே பயன்பட்டால்தான் அந்தச் சமுதாயம் வாழும்,"Even the vast sea will lose its richness, If clouds cease and fail to bestow",,,,
18,சிறப்பொடு பூசனை செல்லாது வானம்\nவறக்குமேல் வானோர்க்கும் ஈண்டு,சிறப்பொடு பூசனை செல்லாது வானம்\nவறக்குமேல் வானோர்க்கும் ஈண்டு,"வானமே பொய்த்து விடும்போது, அதன் பின்னர் அந்த வானத்தில் வாழ்வதாகச் சொல்லப்படுகிறவர்களுக்கு விழாக்கள் ஏது? வழிபாடுதான் ஏது?","If the heavens dry up, the very gods will lack festival and worship",,,,
19,தானம் தவம்இரண்டும் தங்கா வியன்உலகம்\nவானம் வழங்கா தெனின்,தானம் தவம்இரண்டும் தங்கா வியன்உலகம்\nவானம் வழங்கா தெனின்,"இப்பேருலகில் மழை பொய்த்துவிடுமானால் அது, பிறர் பொருட்டுச் செய்யும் தானத்திற்கும், தன்பொருட்டு மேற்கொள்ளும் நோன்புக்கும் தடங்கலாகும்","Both charity and penance would cease in this vast world, should heavens fail to deliver",,,,
20,நீர்இன்று அமையாது உலகெனின் யார்யார்க்கும்\nவான்இன்று அமையாது ஒழுக்கு,நீர்இன்று அமையாது உலகெனின் யார்யார்க்கும்\nவான்இன்று அமையாது ஒழுக்கு,"உலகில் மழையே இல்லையென்றால் ஒழுக்கமே கெடக்கூடும் என்ற நிலை இருப்பதால், நீரின் இன்றியமையாமையை உணர்ந்து செயல்பட வேண்டும்","When water fails, functions of nature cease, you say; Thus when rain fails, no men can walk in 'duty's ordered way'",,,,
21,ஒழுக்கத்து நீத்தார் பெருமை விழுப்பத்து\nவேண்டும் பனுவல் துணிவு,ஒழுக்கத்து நீத்தார் பெருமை விழுப்பத்து\nவேண்டும் பனுவல் துணிவு,"ஒழுக்கத்தில் உறுதியான துறவிகளின் பெருமை, சான்றோர் நூலில் விருப்பமுடனும். உயர்வாகவும் இடம் பெறும்","The settled rule of every code requires, as highest good, Their greatness who, renouncing all, true to their rule have stood",,,,
22,துறந்தார் பெருமை துணைக்கூறின் வையத்து\nஇறந்தாரை எண்ணிக்கொண் டற்று,துறந்தார் பெருமை துணைக்கூறின் வையத்து\nஇறந்தாரை எண்ணிக்கொண் டற்று,உலகில் இறந்தவர்களின் எண்ணிக்கை எவ்வளவு என்று கூற முடியுமா? அதுபோலத்தான் உண்மையாகவே பற்றுகளைத் துறந்த உத்தமர்களின் பெருமையையும் அளவிடவே முடியாது,To recount an ascetic's greatness Is to count the world's dead,,,,
23,இருமை வகைதெரிந்து ஈண்டுஅறம் பூண்டார்\nபெருமை பிறங்கிற்று உலகு,இருமை வகைதெரிந்து ஈண்டுஅறம் பூண்டார்\nபெருமை பிறங்கிற்று உலகு,"நன்மை எது, தீமை எது என்பதை ஆய்ந்தறிந்து நன்மைகளை மேற்கொள்பவர்களே உலகில் பெருமைக் குரியவர்களாவார்கள்","The world shines on the greatness of those who, Knowing both, choose renunciation",,,,
24,உரனென்னும் தோட்டியான் ஓரைந்தும் காப்பான்\nவரனென்னும் வைப்பிற்கோர் வித்தது,உரனென்னும் தோட்டியான் ஓரைந்தும் காப்பான்\nவரனென்னும் வைப்பிற்கோர் வித்தது,"உறுதியென்ற அங்குசம் கொண்டு, ஐம்பொறிகளையும் அடக்கிக்காப்பவன், துறவறம் எனும் நிலத்திற்கு ஏற்ற விதையாவான்",The restraint of senses five by the ankush of firmness Is the seed for the bliss of heaven,,,,
25,ஐந்தவித்தான் ஆற்றல் அகல்விசும்பு ளார்கோமான்\nஇந்திரனே சாலுங் கரி,ஐந்தவித்தான் ஆற்றல் அகல்விசும்பு ளார்கோமான்\nஇந்திரனே சாலுங் கரி,"ஐந்து புலன்களாலாகும் ஆசைகளை ஒழித்தவனுடைய வல்லமைக்கு, வானுலகத்தாரின் தலைவனாகிய இந்திரனே போதுமான சான்று ஆவான்",Even the celestial king Indra will vouch the strength Of one who rules his senses five,,,,
26,செயற்கரிய செய்வார் பெரியர் சிறியர்\nசெயற்கரிய செய்கலா தார்,செயற்கரிய செய்வார் பெரியர் சிறியர்\nசெயற்கரிய செய்கலா தார்,"பெருமை தரும் செயல்களைப் புரிவோரைப் பெரியோர் என்றும்,சிறுமையான செயல்களையன்றிப் பெருமைக்குரிய செயல்களைச் செய்யாதவர்களைச் சிறியோர் என்றும் வரையறுத்துவிட முடியும்",Great people take on difficult tasks; Small people avoid them,,,,
27,சுவைஒளி ஊறுஓசை நாற்றமென ஐந்தின்\nவகைதெரிவான் கட்டே உலகு,சுவைஒளி ஊறுஓசை நாற்றமென ஐந்தின்\nவகைதெரிவான் கட்டே உலகு,ஐம்புலன்களின் இயல்பை உணர்ந்து அவற்றை அடக்கியாளும் திறன் கொண்டவனையே உலகம் போற்றும்,"This world is his who knows for what these five are: Taste, sight, touch, sound and smell",,,,
28,நிறைமொழி மாந்தர் பெருமை நிலத்து\nமறைமொழி காட்டி விடும்,நிறைமொழி மாந்தர் பெருமை நிலத்து\nமறைமொழி காட்டி விடும்,"சான்றோர்களின் பெருமையை, இந்த உலகில் அழியாமல் நிலைத்து நிற்கும் அவர்களது அறவழி நூல்களே எடுத்துக் காட்டும்","The might of men whose word is never vain, The 'secret word' shall to the earth proclaim",,,,
29,குணமென்னும் குன்றேறி நின்றார் வெகுளி\nகணமேயும் காத்தல் அரிது,குணமென்னும் குன்றேறி நின்றார் வெகுளி\nகணமேயும் காத்தல் அரிது,"நல்ல பண்புகளாகிய மலையின்மேல் ஏறி நின்ற பெரியோர், ஒரு கணப்பொழுதே சினம் கொள்வார் ஆயினும் அதிலிருந்து ஒருவரைக் காத்தல் அரிதாகும்",The wrath of those who have scaled the heights of character Can't be endured even for a moment,,,,
30,அந்தணர் என்போர் அறவோர்மற் றெவ்வுயிர்க்கும்\nசெந்தண்மை பூண்டொழுக லான்,அந்தணர் என்போர் அறவோர்மற் றெவ்வுயிர்க்கும்\nசெந்தண்மை பூண்டொழுக லான்,"எல்லா உயிர்களிடத்திலும் செம்மையான அருளை மேற்கொண்டு ஒழுகுவதால், அறவோரே அந்தணர் எனப்படுவோர் ஆவர்",Ascetics are called men of virtue For they assume the role of mercy for all that live,,,,
