id,kural_tamil,kural_english,meaning_tamil,meaning_english,audio_tamil_url,audio_english_url,youtube_tamil_url,youtube_english_url
62,எழுபிறப்பும் தீயவை தீண்டா பழிபிறங்காப்\nபண்புடை மக்கட் பெறின்,எழுபிறப்பும் தீயவை தீண்டா பழிபிறங்காப்\nபண்புடை மக்கட் பெறின்,"பெற்றெடுக்கும் மக்கள் பழிபடராத பண்புடையவர்களாக இருப்பின்,ஏழேழு தலைமுறை எனும் அளவுக்குக் காலமெல்லாம் எந்தத் தீமையும் தீண்டாது","No harm will befell one for even seven births, if one gives birth to children who have irreproachable character.",,,,
63,தம்பொருள் என்பதம் மக்கள் அவர்பொருள்\nதம்தம் வினையான் வரும்,தம்பொருள் என்பதம் மக்கள் அவர்பொருள்\nதம்தம் வினையான் வரும்,தம் பொருள் என்பது தம்மக்களையேயாம். அம்மக்களின் பொருள்கள் அவரவர் செயல்களின் விளைவாக வரக் கூடியவை,One’s children are defined as one’s wealth; the wealth that the children make will be through their own deeds.,,,,
64,அமிழ்தினும் ஆற்ற இனிதேதம் மக்கள்\nசிறுகை அளாவிய கூழ்,அமிழ்தினும் ஆற்ற இனிதேதம் மக்கள்\nசிறுகை அளாவிய கூழ்,"தம்முடைய மக்களின் சிறு கைகளால் அளாவப்பெற்ற உணவு, பெற்றோர்க்கு அமிழ்தத்தை விட மிக்க இனிமை உடையதாகும்",The porridge stirred playfully with the tiny hands of one’s children is sweeter than nectar.,,,,
65,மக்கள்மெய் தீண்டல் உடற்கின்பம் மற்றுஅவர்\nசொற்கேட்டல் இன்பம் செவிக்கு,மக்கள்மெய் தீண்டல் உடற்கின்பம் மற்றுஅவர்\nசொற்கேட்டல் இன்பம் செவிக்கு,"தம் குழந்தைகளைத் தழுவி மகிழ்வது உடலுக்கு இன்பத்தையும், அந்தக் குழந்தைகளின் மழலை மொழி கேட்பது செவிக்கு இன்பத்தையும் வழங்கும்",The tender skin of one’s children is joyous to touch; their sweet voices rapturous to hear,,,,
66,குழல்இனிது யாழ்இனிது என்பதம் மக்கள்\nமழலைச்சொல் கேளா தவர்,குழல்இனிது யாழ்இனிது என்பதம் மக்கள்\nமழலைச்சொல் கேளா தவர்,"தங்கள் குழந்தைகளின் மழலைச் சொல்லைக் கேட்காதவர்கள்தான் குழலோசை, யாழோசை ஆகிய இரண்டும் இனிமையானவை என்று கூறுவார்கள்",Only those who don’t listen to their baby’s sweet babble will claim that a flute or yaazh sounds melodious,,,,
67,தந்தை மகற்காற்று நன்றி அவையத்து\nமுந்தி இருப்பச் செயல்,தந்தை மகற்காற்று நன்றி அவையத்து\nமுந்தி இருப்பச் செயல்,தந்தை தன் மக்களுக்குச் செய்யவேண்டிய நல்லுதவி அவர்களை அறிஞர்கள் அவையில் புகழுடன் விளங்குமாறு ஆக்குதலே ஆகும்,The benefit which a father should confer on his son is to give him precedence in the assembly of the learned.,,,,
68,தம்மின்தம் மக்கள் அறிவுடைமை மாநிலத்து\nமன்னுயிர்க் கெல்லாம் இனிது,தம்மின்தம் மக்கள் அறிவுடைமை மாநிலத்து\nமன்னுயிர்க் கெல்லாம் இனிது,"பெற்றோரைக் காட்டிலும் பிள்ளைகள் அறிவிற் சிறந்து விளங்கினால்,அது பெற்றோருக்கு மட்டுமேயன்றி உலகில் வாழும் அனைவருக்கும் அக மகிழ்ச்சி தருவதாகும்",All living creatures on this earth feel prouder when their children are smarter than themselves,,,,
69,ஈன்ற பொழுதின் பெரிதுவக்கும் தன்மகனைச்\nசான்றோன் எனக்கேட்ட தாய்,ஈன்ற பொழுதின் பெரிதுவக்கும் தன்மகனைச்\nசான்றோன் எனக்கேட்ட தாய்,நல்ல மகனைக் பெற்றெடுத்தவள் என்று ஊரார் பாராட்டும் பொழுது அவனைப் பெற்றபொழுது அடைந்த மகிழ்ச்சியைவிட அதிக மகிழ்ச்சியை அந்தத் தாய் அடைவாள்,The mother who hears her son called “a wise man” will rejoice more than she did at his birth,,,,
70,மகன்தந்தைக்கு ஆற்றும் உதவி இவன்தந்தை\nஎன்நோற்றான் கொல்எனும் சொல்,மகன்தந்தைக்கு ஆற்றும் உதவி இவன்தந்தை\nஎன்நோற்றான் கொல்எனும் சொல்,"""ஆகா! இவனைப் பிள்ளையாகப் பெற்றது இவன் தந்தை பெற்ற பெரும்பேறு"",என்று ஒரு மகன் புகழப் படுவதுதான், அவன் தன்னுடையதந்தைக்குச் செய்யக் கூடிய கைம்மாறு எனப்படும்",The duty of a son towards his father is to make others wonder what great deeds did the father do to deserve such a son,,,,
71,அன்பிற்கும் உண்டோ அடைக்குந்தாழ் ஆர்வலர்\nபுன்கணீர் பூசல் தரும்,அன்பிற்கும் உண்டோ அடைக்குந்தாழ் ஆர்வலர்\nபுன்கணீர் பூசல் தரும்,"உள்ளத்தில் இருக்கும் அன்பைத் தாழ்ப்பாள் போட்டு அடைத்து வைக்க முடியாது. அன்புக்குரியவரின் துன்பங்காணுமிடத்து, கண்ணீர்த்துளி வாயிலாக அது வெளிப்பட்டு விடும்",Can there be a latch to lock in and hide love? It will reveal itself through tears when a loved one is in trouble.,,,,
72,அன்பிலார் எல்லாம் தமக்குரியர் அன்புடையார்\nஎன்பும் உரியர் பிறர்க்கு,அன்பிலார் எல்லாம் தமக்குரியர் அன்புடையார்\nஎன்பும் உரியர் பிறர்க்கு,"அன்பு இல்லாதவர், எல்லாம் தமக்கே என உரிமை கொண்டாடுவர்; அன்பு உடையவரோ தம் உடல், பொருள், ஆவி ஆகிய அனைத்தும் பிறருக்கென எண்ணிடுவர்",Loveless people hold everything to themselves. Those who are filled with love bear even their bones for others,,,,
73,அன்போடு இயைந்த வழக்கென்ப ஆருயிர்க்கு\nஎன்போடு இயைந்த தொடர்பு,அன்போடு இயைந்த வழக்கென்ப ஆருயிர்க்கு\nஎன்போடு இயைந்த தொடர்பு,உயிரும் உடலும்போல் அன்பும் செயலும் இணைந்திருப்பதே உயர்ந்த பொருத்தமாகும்,They say that the union of soul and body in man is the fruit of the union of love and virtue,,,,
74,அன்புஈனும் ஆர்வம் உடைமை அதுஈனும்\nநண்பென்னும் நாடாச் சிறப்பு,அன்புஈனும் ஆர்வம் உடைமை அதுஈனும்\nநண்பென்னும் நாடாச் சிறப்பு,"அன்பு பிறரிடம் பற்றுள்ளம் கொள்ளச் செய்யும். அந்த உள்ளம், நட்பு எனும் பெருஞ்சிறப்பை உருவாக்கும்","Love yields affection for all, which leads to invaluable friendships",,,,
75,அன்புற்று அமர்ந்த வழக்கென்ப வையகத்து\nஇன்புற்றார் எய்தும் சிறப்பு,அன்புற்று அமர்ந்த வழக்கென்ப வையகத்து\nஇன்புற்றார் எய்தும் சிறப்பு,"உலகில் இன்புற்று வாழ்கின்றவர்க்கு வாய்க்கும் சிறப்பு, அவர் அன்புள்ளம் கொண்டவராக விளங்குவதன் பயனே என்று கூறலாம்","The honour for those who found joy in this world Is the result of leading a life of love, it’s said",,,,
76,அறத்திற்கே அன்புசார் பென்ப அறியார்\nமறத்திற்கும் அஃதே துணை,அறத்திற்கே அன்புசார் பென்ப அறியார்\nமறத்திற்கும் அஃதே துணை,"வீரச் செயல்களுக்கும் அன்பு துணையாகத் திகழ்கிறது என்பதை அறியாதவர்களே, அறச் செயல்களுக்கு மட்டுமே அன்பு துணையாக இருப்பதாகக் கூறுவார்கள்",The ignorant think that love is needed only for righteous deeds; they know not that love is an ally for bravery too,,,,
77,என்பி லதனை வெயில்போலக் காயுமே\nஅன்பி லதனை அறம்,என்பி லதனை வெயில்போலக் காயுமே\nஅன்பி லதனை அறம்,"அறம் எதுவென அறிந்தும் அதனைக் கடைப்பிடிக்காத வரை, அவரது மனச்சாட்சியே வாட்டி வதைக்கும். அது வெயிலின் வெம்மை புழுவை வாட்டுவதுபோல இருக்கும்","Virtue will burn up the soul which is without love, even as the sun burns up the creature which is without bone, i.e. worms",,,,
78,அன்பகத் தில்லா உயிர்வாழ்க்கை வன்பாற்கண்\nவற்றல் மரந்தளிர்த் தற்று,அன்பகத் தில்லா உயிர்வாழ்க்கை வன்பாற்கண்\nவற்றல் மரந்தளிர்த் தற்று,"மனத்தில் அன்பு இல்லாதவருடைய வாழ்க்கை, பாலை வானத்தில் பட்டமரம் தளிர்த்தது போன்றது",The domestic state of that man whose mind is without love is like the flourishing of a withered tree upon the parched desert,,,,
79,புறத்துறுப் பெல்லாம் எவன்செய்யும் யாக்கை\nஅகத்துறுப்பு அன்பி லவர்க்கு,புறத்துறுப் பெல்லாம் எவன்செய்யும் யாக்கை\nஅகத்துறுப்பு அன்பி லவர்க்கு,அன்பு எனும் அகத்து உறுப்பு இல்லாதவர்க்குப் புறத்து உறுப்புகள் அழகாக இருந்து என்ன பயன்?,"What useful things can external body parts do, if the heart is devoid of love.",,,,
80,அன்பின் வழியது உயிர்நிலை அஃதிலார்க்கு\nஎன்புதோல் போர்த்த உடம்பு,அன்பின் வழியது உயிர்நிலை அஃதிலார்க்கு\nஎன்புதோல் போர்த்த உடம்பு,"அன்புநெஞ்சத்தின் வழியில் இயங்குவதே உயிருள்ள உடலாகும்;இல்லையேல், அது எலும்பைத் தோல் போர்த்திய வெறும் உடலேயாகும்","Only a person who follows the path of love, is in a state of living; else it is just a skeleton dressed with skin.",,,,
81,இருந்தோம்பி இல்வாழ்வ தெல்லாம் விருந்தோம்பி\nவேளாண்மை செய்தற் பொருட்டு,இருந்தோம்பி இல்வாழ்வ தெல்லாம் விருந்தோம்பி\nவேளாண்மை செய்தற் பொருட்டு,வீட்டில்‌ இருந்து பொருள்களைக்‌ காத்து இல்வாழ்க்கை நடத்துவதெல்லாம்‌ விருந்தினரைப்‌ போற்றி உதவிசெய்யும்‌ பொருட்டே ஆகும்‌,"The purpose of nurturing wealth and leading a family life, is to be able to be hospitable to guests",,,,
82,விருந்து புறத்ததாத் தானுண்டல் சாவா\nமருந்தெனினும் வேண்டாற்பாற் றன்று,விருந்து புறத்ததாத் தானுண்டல் சாவா\nமருந்தெனினும் வேண்டாற்பாற் றன்று,விருந்தினராக வந்தவர்‌ வீட்டின்‌ புறத்தே இருக்கத்‌ தான்‌ மட்டும்‌ உண்பது சாவாமருந்தாகிய அமிழ்தமே ஆனாலும்‌ அது விரும்பத்தக்கது அன்று,"Even if you have nectar that will assure immortality, it is not appreciable to dine alone, leaving the guests out",,,,
83,வருவிருந்து வைகலும் ஓம்புவான் வாழ்க்கை\nபருவந்து பாழ்படுதல் இன்று,வருவிருந்து வைகலும் ஓம்புவான் வாழ்க்கை\nபருவந்து பாழ்படுதல் இன்று,"தன்னை நோக்கி வரும்‌ விருந்தினரை நாள்தோறும்‌ போற்றுகின்றவனுடைய வாழ்க்கை, துன்பத்தால்‌ வருந்திக்‌ கெட்டுப்‌ போவதில்லை",The domestic life of the man that daily entertains the guests who come to him shall not be laid waste by poverty,,,,
84,அகனமர்ந்து செய்யாள் உறையும் முகனமர்ந்து\nநல்விருந்து ஓம்புவான் இல்,அகனமர்ந்து செய்யாள் உறையும் முகனமர்ந்து\nநல்விருந்து ஓம்புவான் இல்,மனமகிழ்ச்சியை முகமலர்ச்சியால் காட்டி விருந்தினரை வரவேற்பவர் வீட்டில் அமர்ந்து செல்வம் எனும் திருமகள் வாழ்வாள்,The Goddess of wealth will reside happily with someone who attends to his guests with a smile on the face,,,,
85,வித்தும் இடல்வேண்டும் கொல்லோ விருந்தோம்பி\nமிச்சில் மிசைவான் புலம்,வித்தும் இடல்வேண்டும் கொல்லோ விருந்தோம்பி\nமிச்சில் மிசைவான் புலம்,விருந்தினரை முன்னே போற்றி உணவளித்து மிஞ்சிய உணவை உண்டு வாழ்கின்றவனுடைய நிலத்தில்‌ விதையும்‌ விதைக்க வேண்டுமோ?,"Does one even need to sow his field, if he always eats only what remains after feeding his guests?",,,,
86,செல்விருந்து ஓம்பி வருவிருந்து பார்த்திருப்பான்\nநல்வருந்து வானத் தவர்க்கு,செல்விருந்து ஓம்பி வருவிருந்து பார்த்திருப்பான்\nநல்வருந்து வானத் தவர்க்கு,"வந்த விருந்தினரை உபசரித்து அவர்களை வழியனுப்பி வைக்கும்போதே, மேலும் வரக்கூடிய விருந்தினரை ஆவலுடன் எதிர்நோக்கி நிற்பவனை, புகழ்வானில் இருப்போர் நல்ல விருந்தினன் என்று வரவேற்றுப் போற்றுவர்","One who is hospitable to his guests, and when they leave, awaits his next guests, will be a welcome-guest in the heavens",,,,
87,இனைத்துணைத் தென்பதொன் றில்லை விருந்தின்\nதுணைத்துணை வேள்விப் பயன்,இனைத்துணைத் தென்பதொன் றில்லை விருந்தின்\nதுணைத்துணை வேள்விப் பயன்,"விருந்தோம்புதலாகிய வேள்வியின் பயன் இவ்வளவு என்று அளவு படுத்தி கூறத்தக்கது அன்று, விருந்தினரின் தகுதிக்கு ஏற்ற அளவினதாகும்",We can’t quantify the benefits of hospitality; it is limited only by the quality of the guests,,,,
88,பரிந்தோம்பிப் பற்றற்றேம் என்பர் விருந்தோம்பி\nவேள்வி தலைப்படா தார்,பரிந்தோம்பிப் பற்றற்றேம் என்பர் விருந்தோம்பி\nவேள்வி தலைப்படா தார்,"செல்வத்தைச் சேர்த்துவைத்து அதனை இழக்கும்போது, விருந்தோம்பல் எனும் வேள்விக்கு அது பயன்படுத்தப்படாமற் போயிற்றே என வருந்துவார்கள்","Those who dont take up hospitality as a spiritual ritual, will later repent that they have lost the wealth they loved",,,,
89,உடைமையுள் இன்மை விருந்தோம்பல் ஓம்பா\nமடமை மடவார்கண் உண்டு,உடைமையுள் இன்மை விருந்தோம்பல் ஓம்பா\nமடமை மடவார்கண் உண்டு,விருந்தினரை வரவேற்றுப் போற்றத் தெரியாத அறிவற்றவர்கள் எவ்வளவு பணம் படைத்தவர்களாக இருந்தாலும் தரித்திரம் பிடித்தவர்களாகவே கருதப்படுவார்கள்,That stupidity which excercises no hospitality is poverty in the midst of wealth. It is the property of the stupid,,,,
90,மோப்பக் குழையும் அனிச்சம் முகந்திரிந்து\nநோக்கக் குநழ்யும் விருந்து,மோப்பக் குழையும் அனிச்சம் முகந்திரிந்து\nநோக்கக் குநழ்யும் விருந்து,"அனிச்சம் எனப்படும் பூ, முகர்ந்தவுடன் வாடி விடக் கூடியது.அதுபோல் சற்று முகங்கோணி வரவேற்றாலே விருந்தினர் வாடிவிடுவர்","The flower, anicham, shrivels when it is smelt. A guest will wilt if the host’s face betrays the slightest twitch.",,,,
91,இன்சொலால் ஈரம் அளைஇப் படிறுஇலவாம்\nசெம்பொருள் கண்டார்வாய்ச் சொல்,இன்சொலால் ஈரம் அளைஇப் படிறுஇலவாம்\nசெம்பொருள் கண்டார்வாய்ச் சொல்,"ஒருவர் வாயிலிருந்து வரும் சொல் அன்பு கலந்ததாகவும்,வஞ்சனையற்றதாகவும், வாய்மையுடையதாகவும் இருப்பின் அதுவேஇன்சொல் எனப்படும்",Sweet words are those which imbued with love and free from deceit flow from the mouth of the virtuous,,,,
92,அகன்அமர்ந்து ஈதலின் நன்றே முகனமர்ந்து\nஇன்சொலன் ஆகப் பெறின்,அகன்அமர்ந்து ஈதலின் நன்றே முகனமர்ந்து\nஇன்சொலன் ஆகப் பெறின்,"முகம்‌ மலர்ந்து இன்சொல்‌ உடையவனாக இருக்கப்‌ பெற்றால்‌, மனம்‌ மகிழ்ந்து பொருள்‌ கொடுக்கும்‌ ஈகையைவிட நல்லதாகும்‌",To be someone who speaks sweet words with a smile is even better than being philanthropic with a happy heart,,,,
93,முகத்தான் அமர்ந்துஇனிது நோக்கி அகத்தானாம்\nஇன்சொ லினதே அறம்,முகத்தான் அமர்ந்துஇனிது நோக்கி அகத்தானாம்\nஇன்சொ லினதே அறம்,"முகம் மலர நோக்கி, அகம் மலர இனிய சொற்களைக் கூறுவதே அறவழியில் அமைந்த பண்பாகும்","Sweet speech, flowing from the heart (uttered) with a cheerful countenance and a sweet look, is true virtue",,,,
