id,kural_tamil,kural_english,meaning_tamil,meaning_english,audio_tamil_url,audio_english_url,youtube_tamil_url,youtube_english_url
31,சிறப்புஈனும் செல்வமும் ஈனும் அறத்தினூஉங்கு\nஆக்கம் எவனோ உயிர்க்கு,சிறப்புஈனும் செல்வமும் ஈனும் அறத்தினூஉங்கு\nஆக்கம் எவனோ உயிர்க்கு,"சிறப்பையும், செழிப்பையும் தரக்கூடிய அறவழி ஒன்றைத்தவிர ஆக்கமளிக்கக் கூடிய வழி வேறென்ன இருக்கிறது?","What gain greater than virtue can a living man obtain, Which yields fame and fortune?",,,,
32,அறத்தினூஉங்கு ஆக்கமும் இல்லை அதனை\nமறத்தலின் ஊங்கில்லை கேடு,அறத்தினூஉங்கு ஆக்கமும் இல்லை அதனை\nமறத்தலின் ஊங்கில்லை கேடு,நன்மைகளின் விளைநிலமாக இருக்கும் அறத்தைப் போல் ஒருவருடைய வாழ்க்கைக்கு ஆக்கம் தரக் கூடியது எதுவுமில்லை; அந்த அறத்தை மறப்பதை விடத் தீமையானதும் வேறில்லை,There is no greater gain than virtue.No surer path to ruin than its neglect,,,,
33,ஒல்லும் வகையான் அறவினை ஓவாதே\nசெல்லும்வாய் எல்லாஞ் செயல்,ஒல்லும் வகையான் அறவினை ஓவாதே\nசெல்லும்வாய் எல்லாஞ் செயல்,"செய்யக்கூடிய செயல்கள் எவை ஆயினும், அவை எல்லா இடங்களிலும் தொய்வில்லாத அறவழியிலேயே செய்யப்பட வேண்டும்",The right thing to do is to be righteous At all places and all times,,,,
34,மனத்துக்கண் மாசிலன் ஆதல் அனைத்தறன்\nஆகுல நீர பிற,மனத்துக்கண் மாசிலன் ஆதல் அனைத்தறன்\nஆகுல நீர பிற,மனம் தூய்மையாக இருப்பதே அறம்; மற்றவை ஆரவாரத்தைத் தவிர வேறொன்றுமில்லை,A blemishless mind is the basis of all virtue.Everything else is empty show,,,,
35,அழுக்காறு அவாவெகுளி இன்னாச்சொல் நான்கும்\nஇழுக்கா இயன்றது அறம்,அழுக்காறு அவாவெகுளி இன்னாச்சொல் நான்கும்\nஇழுக்கா இயன்றது அறம்,"பொறாமை, பேராசை, பொங்கும் கோபம், புண்படுத்தும் சொல் ஆகிய இந்த நான்கும் அறவழிக்குப் பொருந்தாதவைகளாகும்","Envy, greed, wrath and harsh words: These four avoided is virtue",,,,
36,அன்றறிவாம் என்னாது அறஞ்செய்க மற்றது\nபொன்றுங்கால் பொன்றாத் துணை,அன்றறிவாம் என்னாது அறஞ்செய்க மற்றது\nபொன்றுங்கால் பொன்றாத் துணை,பிறகு பார்த்துக்கொள்ளலாம் என்று நாள் கடத்தாமல் அறவழியை மேற்கொண்டால் அது ஒருவர் இறந்தபின் கூட அழியாப் புகழாய் நிலைத்துத் துணை நிற்கும்,Defer not virtue but practice now.At the dying hour she will be your undying friend,,,,
37,அறத்தாறு இதுவென வேண்டா சிவிகை\nபொறுத்தானோடு ஊர்ந்தான் இடை,அறத்தாறு இதுவென வேண்டா சிவிகை\nபொறுத்தானோடு ஊர்ந்தான் இடை,"அறவழியில் நடப்பவர்கள் பல்லக்கில் உட்கார்ந்து செல்பவர்களைப் போல வாழ்க்கையில் வரும் இன்ப துன்பங்கள் இரண்டையும் எளியவாகக் கருதி மகிழ்வுடன் பயணத்தை மேற்கொள்வார்கள். தீய வழிக்குத் தங்களை ஆட்படுத்திக் கொண்டவர்களோ பல்லக்கைத் தூக்கிச் சுமப்பவர்களைப் போல இன்பத்திலும் அமைதி கொள்ளாமல், துன்பத்தையும் தாங்கிக் கொள்ளும் மனப்பக்குவமின்றி வாழ்வையே பெரும் சுமையாகக் கருதுவார்கள்",Inquiring about virtues' benefits?See that between The rider and bearer of a palanquin,,,,
38,வீழ்நாள் படாஅமை நன்றாற்றின் அஃதொருவன்\nவாழ்நாள் வழியடைக்கும் கல்,வீழ்நாள் படாஅமை நன்றாற்றின் அஃதொருவன்\nவாழ்நாள் வழியடைக்கும் கல்,"பயனற்றதாக ஒருநாள்கூடக் கழிந்து போகாமல், தொடர்ந்து நற்செயல்களில் ஈடுபடுபவருக்கு வாழ்க்கைப் பாதையைச் சீராக்கி அமைத்துத் தரும் கல்லாக அந்த நற்செயல்களே விளங்கும்",The good you do without wasting a day Is the stone that blocks the way to rebirth.,,,,
39,அறத்தான் வருவதே இன்பம் மற்றெல்லாம்\nபுறத்த புகழும் இல,அறத்தான் வருவதே இன்பம் மற்றெல்லாம்\nபுறத்த புகழும் இல,தூய்மையான நெஞ்சுடன் நடத்தும் அறவழி வாழ்க்கையில் வருகின்ற புகழால் ஏற்படுவதே இன்பமாகும். அதற்கு மாறான வழியில் வருவது புகழும் ஆகாது; இன்பமும் ஆகாது,"Virtue alone brings happiness; All else is naught, and without praise",,,,
40,செயற்பால தோரும் அறனே ஒருவற்கு\nஉயற்பால தோரும் பழி,செயற்பால தோரும் அறனே ஒருவற்கு\nஉயற்பால தோரும் பழி,பழிக்கத் தக்கவைகளைச் செய்யாமல் பாராட்டத்தக்க அறவழிச் செயல்களில் நாட்டம் கொள்வதே ஒருவர்க்குப் புகழ் சேர்க்கும்,Virtue' sums the things that should be done; 'Vice' sums the things that man should shun,,,,
41,இல்வாழ்வான் என்பான் இயல்புடைய மூவர்க்கும்\nநல்லாற்றின் நின்ற துணை,இல்வாழ்வான் என்பான் இயல்புடைய மூவர்க்கும்\nநல்லாற்றின் நின்ற துணை,"பெற்றோர், வாழ்க்கைத் துணை, குழந்தைகள் என இயற்கையாக அமைந்திடும் மூவர்க்கும் துணையாக இருப்பது இல்லறம் நடத்துவோர் கடமையாகும்","A good family person is one who supports all three relationships (parents, wife, children) in a balanced and righteous manner.",,,,
42,துறந்தார்க்கும் துவ்வா தவர்க்கும் இறந்தார்க்கும்\nஇல்வாழ்வான் என்பான் துணை,துறந்தார்க்கும் துவ்வா தவர்க்கும் இறந்தார்க்கும்\nஇல்வாழ்வான் என்பான் துணை,"பற்றற்ற துறவிகட்கும், பசியால் வாடுவோர்க்கும், பாதுகாப்பற்றவர்க்கும் இல்லற வாழ்வு நடத்துவோர் துணையாக இருத்தல் வேண்டும்","He will be said to flourish in domestic virtue who aids the forsaken, the poor, and the dead",,,,
43,தென்புலத்தார் தெய்வம் விருந்தொக்கல் தானென்றாங்கு\nஐம்புலத்தாறு ஓம்பல் தலை,தென்புலத்தார் தெய்வம் விருந்தொக்கல் தானென்றாங்கு\nஐம்புலத்தாறு ஓம்பல் தலை,"வாழ்ந்து மறைந்தோரை நினைவுகூர்தல், வாழ்வாங்கு வாழ்வோரைப் போற்றுதல், விருந்தோம்பல், சுற்றம் பேணல் ஆகிய கடமைகளை நிறைவேற்றத் தன்னை நிலைப்படுத்திக் கொள்ளல் எனப்படும் ஐவகை அறநெறிகளும் இல்வாழ்வுக் குரியனவாம்","Teachers, God, guests, relatives and oneself – it is important to nurture all these five in addition to the family.",,,,
44,பழியஞ்சிப் பாத்தூண் உடைத்தாயின் வாழ்க்கை\nவழியெஞ்சல் எஞ்ஞான்றும் இல்,பழியஞ்சிப் பாத்தூண் உடைத்தாயின் வாழ்க்கை\nவழியெஞ்சல் எஞ்ஞான்றும் இல்,"பழிக்கு அஞ்சாமல் சேர்ந்த பொருள் கணக்கின்றி இருப்பினும் அதைவிட, பழிக்கு அஞ்சிச் சேர்த்தபொருளைப் பகுத்து உண்ணும் பண்பிலேதான் வாழ்க்கையின் ஒழுக்கமே இருக்கிறது","One who earns well but avoids the blame of hoarding wealth, by philanthropy, will lead a complete life with no complaints",,,,
45,அன்பும் அறனும் உடைத்தாயின் இல்வாழ்க்கை\nபண்பும் பயனும் அது,அன்பும் அறனும் உடைத்தாயின் இல்வாழ்க்கை\nபண்பும் பயனும் அது,இல்வாழ்க்கை பண்புடையதாகவும் பயனுடையதாகவும் விளங்குவதற்கு அன்பான உள்ளமும் அதையொட்டிய நல்ல செயல்களும் தேவை,"If love and virtue pervade the family life, they become the characteristic and fruit of the family life",,,,
46,அறத்தாற்றின் இல்வாழ்க்கை ஆற்றின் புறத்தாற்றில்\nபோஒய்ப் பெறுவ தெவன்,அறத்தாற்றின் இல்வாழ்க்கை ஆற்றின் புறத்தாற்றில்\nபோஒய்ப் பெறுவ தெவன்,"அறநெறியில் இல்வாழ்க்கையை அமைத்துக் கொண்டவர்கள் பெற்றிடும் பயனை, வேறு நெறியில் சென்று பெற்றிட இயலுமோ? இயலாது","The only way to live is to live righteously; if you set aside virtues, what more is there to gain?",,,,
47,இயல்பினான் இல்வாழ்க்கை வாழ்பவன் என்பான்\nமுயல்வாருள் எல்லாம் தலை,இயல்பினான் இல்வாழ்க்கை வாழ்பவன் என்பான்\nமுயல்வாருள் எல்லாம் தலை,"நல்வாழ்வுக்கான முயற்சிகளை மேற்கொள்வோரில் தலையானவராகத் திகழ்பவர், இல்வாழ்வின் இலக்கணமுணர்ந்து அதற்கேற்ப வாழ்பவர்தான்.",Among all those who labour (for future happiness) he is greatest who lives well in the household state,,,,
48,ஆற்றின் ஒழுக்கி அறனிழுக்கா இல்வாழ்க்கை\nநோற்பாரின் நோன்மை உடைத்து,ஆற்றின் ஒழுக்கி அறனிழுக்கா இல்வாழ்க்கை\nநோற்பாரின் நோன்மை உடைத்து,"தானும் அறவழியில் நடந்து, பிறரையும் அவ்வழியில் நடக்கச் செய்திடுவோரின் இல்வாழ்க்கை, துறவிகள் கடைப்பிடிக்கும் நோன்பைவிடப் பெருமையுடையதாகும்","The householder who, not swerving from virtue, helps the ascetic in his way, endures more than those who endure penance",,,,
49,அறன்எனப் பட்டதே இல்வாழ்க்கை அஃதும்\nபிறன்பழிப்ப தில்லாயின் நன்று,அறன்எனப் பட்டதே இல்வாழ்க்கை அஃதும்\nபிறன்பழிப்ப தில்லாயின் நன்று,அறம்‌ என்று சிறப்பித்துச்‌ சொல்லப்பட்டது இல்வாழ்க்கையே ஆகும்‌; அதுவும்‌ மற்றவன்‌ பழிக்கும்‌ குற்றம்‌ இல்லாமல்‌ விளங்கினால்‌ மேலும்‌ நன்மையாகும்‌,"The marriage state is truly called virtue. The other state is also good, if others do not reproach it",,,,
50,வையத்துள் வாழ்வாங்கு வாழ்பவன் வான்உநற்யும்\nதெய்வத்துள் வைக்கப் படும்,வையத்துள் வாழ்வாங்கு வாழ்பவன் வான்உநற்யும்\nதெய்வத்துள் வைக்கப் படும்,"உலகத்தில்‌ வாழவேண்டிய அறநெறியில்‌ நின்று வாழ்கின்றவன்‌, வானுலகத்தில்‌ உள்ள தெய்வமுறையில்‌ வைத்து மதிக்கப்படுவான்‌","He who on earth has lived in the conjugal state as he should live, will be placed among the Gods who dwell in heaven",,,,
51,மனைக்தக்க மாண்புடையள் ஆகித்தற் கொண்டான்\nவளத்தக்காள் வாழ்க்கைத் துணை,மனைக்தக்க மாண்புடையள் ஆகித்தற் கொண்டான்\nவளத்தக்காள் வாழ்க்கைத் துணை,"இல்லறத்திற்குரிய பண்புகளுடன், பொருள் வளத்துக்குத் தக்கவாறு குடும்பம் நடத்துபவள், கணவனின் வாழ்வுக்குப் பெருந்துணையாவாள்",A spouse who possesses virtues required for the family and spends within the means is the ideal life partner,,,,
52,மனைமாட்சி இல்லாள்கண் இல்லாயின் வாழ்க்கை\nஎனைமாட்சித் தாயினும் இல்,மனைமாட்சி இல்லாள்கண் இல்லாயின் வாழ்க்கை\nஎனைமாட்சித் தாயினும் இல்,நற்பண்புள்ள மனைவி அமையாத இல்வாழ்க்கை எவ்வளவு சிறப்புடையதாக இருந்தாலும் அதற்குத் தனிச்சிறப்புக் கிடையாது,"If your spouse doesnt possess the virtues needed for married life, whatever else you possess in life is irrelevant.",,,,
53,இல்லதென் இல்லவள் மாண்பானால் உள்ளதென்\nஇல்லவள் மாணாக் கடை,இல்லதென் இல்லவள் மாண்பானால் உள்ளதென்\nஇல்லவள் மாணாக் கடை,நல்ல பண்புடைய மனைவி அமைந்த வாழ்க்கையில் எல்லாம் இருக்கும். அப்படியொரு மனைவி அமையாத வாழ்க்கையில் எதுவுமே இருக்காது,"If your spouse has the qualities suited for family life, what is it that you dont have? If not, what is it that you have?",,,,
54,பெண்ணின் பெருந்தக்க யாவுள கற்பென்னும்\nதிண்மைஉண் டாகப் பெறின்,பெண்ணின் பெருந்தக்க யாவுள கற்பென்னும்\nதிண்மைஉண் டாகப் பெறின்,"இல்வாழ்க்கையில் கற்பு என்னும் உறுதிநிலை இருக்கப் பெற்றால், பெண்ணைவிட பெருமையுடையவை வேறு என்ன இருக்கின்றன?","If your spouse is strongly virtuous, can there be anything worthier that your spouse?",,,,
55,தெய்வம் தொழாஅள் கொழுநன் தொழுதெழுவாள்\nபெய்யெனப் பெய்யும் மழை,தெய்வம் தொழாஅள் கொழுநன் தொழுதெழுவாள்\nபெய்யெனப் பெய்யும் மழை,வேறு தெய்வம் தொழாதவளாய்த் தன் கணவனையே தெய்வமாகக் கொண்டு தொழுது துயிலெழுகின்றவள் பெய் என்றால் மழை பெய்யும்,A person who respects the spouse more than God is like rain that pours instantly on demand,,,,
56,தற்காத்துத் தற்கொண்டாற் பேணித் தகைசான்ற\nசொற்காத்துச் சோர்விலாள் பெண்,தற்காத்துத் தற்கொண்டாற் பேணித் தகைசான்ற\nசொற்காத்துச் சோர்விலாள் பெண்,"கற்புநெறியில் தன்னையும் தன் கணவனையும் காத்துக் கொண்டு,தமக்குப் பெருமை சேர்க்கும் புகழையும் காப்பாற்றிக் கொள்வதில் உறுதி குலையாமல் இருப்பவள் பெண்","A woman not only protects herself, but tirelessly takes care of her husband and preserves the family reputation",,,,
57,சிறைகாக்கும் காப்பெவன் செய்யும் மகளிர்\nநிறைகாக்கும் காப்பே தலை,சிறைகாக்கும் காப்பெவன் செய்யும் மகளிர்\nநிறைகாக்கும் காப்பே தலை,மகளிரைக்‌ காவல்‌ வைத்துக்‌ காக்கும்‌ காப்புமுறை என்ன பயனை உண்டாக்கும்‌? அவர்கள்‌ நிறை என்னும்‌ பண்பால்‌ தம்மைத்‌ தாம்‌ காக்கும்‌ காப்பே சிறந்தது,Is it of any use to possess women by imposing physical barriers? A woman will remain virtuous only on her own volition.,,,,
58,பெற்றாற் பெறின்பெறுவர் பெண்டிர் பெருஞ்சிறப்புப்\nபுத்தேளிர் வாழும் உலகு,பெற்றாற் பெறின்பெறுவர் பெண்டிர் பெருஞ்சிறப்புப்\nபுத்தேளிர் வாழும் உலகு,"நற்பண்பு பெற்றவனைக் கணவனாகப் பெற்றால், பெண்டிர்க்கு இல்வாழ்க்கையெனும் புதிய உலகம் பெருஞ்சிறப்பாக அமையும்","If a woman gets a spouse with great character, she will enjoy the glory of heaven on earth",,,,
59,புகழ்புரிந்த இல்லிலோர்க்கு இல்லை இகழ்வார்முன்\nஏறுபோல் பீடு நடை,புகழ்புரிந்த இல்லிலோர்க்கு இல்லை இகழ்வார்முன்\nஏறுபோல் பீடு நடை,"புகழைக் காக்க விரும்பும் மனைவி இல்லாதவர்க்கு, இகழ்ந்து பேசும் பகைவர் முன் காளை போல் நடக்கும் பெருமித நடை இல்லை","The man whose wife seeks not the praise (of chastity) cannot walk with lion-like stately step, before those who revile them",,,,
60,மங்கலம் என்ப மனைமாட்சி மற்றுஅதன்\nநன்கலம் நன்மக்கட் பேறு,மங்கலம் என்ப மனைமாட்சி மற்றுஅதன்\nநன்கலம் நன்மக்கட் பேறு,குடும்பத்தின் பண்பாடுதான் இல்வாழ்க்கையின் சிறப்பு; அதற்கு மேலும் சிறப்பு நல்ல பிள்ளைகளைப் பெற்றிருப்பது,A great harmonious married life is a boon; having good offsprings adds luster to it,,,,
61,பெறுமவற்றுள் யாமறிவது இல்லை அறிவறிந்த\nமக்கட்பேறு அல்ல பிற,பெறுமவற்றுள் யாமறிவது இல்லை அறிவறிந்த\nமக்கட்பேறு அல்ல பிற,அறிவில் சிறந்த நல்ல பிள்ளைகளைவிட இல்வாழ்க்கையில் சிறந்த பேறு வேறு எதுவுமில்லை,"Other than having children who are wise enough to know what needs to be known, there is no other treasure that I value more",,,,
